{
  "$comment": "CHANGELOG: Unified product schema (array of objects).",
  "$schema": "http://json-schema.org/draft-07/schema#",
  "type": "array",
  "items": {
    "type": "object",
    "required": ["name", "quantity"],
    "properties": {
      "name": {"type": "string"},
      "unit": {"type": "string"},
      "quantity": {"type": "number"},
      "package_size": {"type": "number"},
      "pack_size": {"type": ["integer", "null"]},
      "threshold": {"type": "number"},
      "main": {"type": "boolean"},
      "category": {"type": "string"},
      "storage": {"type": "string"},
      "key": {"type": "string"},
      "name_key": {"type": "string"}
    },
    "additionalProperties": true
  }
}
