[
  {
    "name": "Milk",
    "quantity": 2,
    "unit": "l",
    "category": "dairy",
    "storage": "fridge",
    "main": true
  },
  {
    "name": "Bread",
    "quantity": 1,
    "unit": "loaf",
    "category": "bakery",
    "storage": "pantry",
    "main": true
  },
  {
    "name": "Apple",
    "quantity": 6,
    "unit": "pcs",
    "category": "fruit",
    "storage": "pantry",
    "main": false
  }
]
